{
  "task_id": "TASK-001",
  "status": "ok",
  "blocked_reasons": [],
  "evidence_refs": [
    {
      "evidence_id": "E001",
      "revision": 1,
      "locator": "消息 1，脱敏摘要第 1 段"
    }
  ],
  "facts": [
    {
      "claim_type": "accepted_claim_summary",
      "domain": "coordination",
      "statement": "合成线程材料显示 JDBC 等待；数据库机制尚未核验。",
      "scope": {
        "object_alias": "APP_A",
        "event_window": "合成窗口 W1",
        "timezone": null,
        "limitations": "合成测试材料，非现场观测"
      },
      "evidence_refs": [
        {
          "evidence_id": "E001",
          "revision": 1,
          "locator": "消息 1，脱敏摘要第 1 段"
        }
      ],
      "source_kind": "ACCEPTED_RESULT",
      "basis_claim_ids": [
        "CLAIM-001"
      ]
    }
  ],
  "candidates": [
    {
      "domain": "java",
      "hypothesis": "连接长期占用可能导致应用排队。",
      "scope": {
        "object_alias": "APP_A",
        "event_window": "合成窗口 W1",
        "timezone": null,
        "limitations": "合成测试材料，非现场观测"
      },
      "support_refs": [
        {
          "evidence_id": "E001",
          "revision": 1,
          "locator": "消息 1，脱敏摘要第 1 段"
        }
      ],
      "counterevidence_refs": [],
      "counterevidence_status": "NOT_OBTAINED",
      "falsification_condition": "若同窗连接借出时长正常且队列在其他位置，当前解释应下调。",
      "critical_alternatives": [
        "下游响应延迟，尚待对应域验证。"
      ],
      "next_validation": "比较同窗等待位置与借出时长是否一致，不新增隐藏取证请求。",
      "ordinal_rank": 1,
      "rank_reason": "合成材料只支持应用等待这一有限解释。",
      "basis_claim_ids": [
        "CLAIM-002"
      ],
      "candidate_ref": "H01",
      "posterior_direction": "UP",
      "evidence_effects": [
        {
          "evidence_ref": {
            "evidence_id": "E001",
            "revision": 1,
            "locator": "消息 1，脱敏摘要第 1 段"
          },
          "effect": "SUPPORTS",
          "expected_if_true": "COMMON",
          "expected_if_false": "UNCOMMON",
          "reason": "合成理由"
        }
      ]
    }
  ],
  "pending": [],
  "excluded": [],
  "request_proposals": [
    {
      "artifact_kind": "existing_pool_summary",
      "purpose": "区分连接长期占用与其他排队位置",
      "related_evidence_refs": [
        {
          "evidence_id": "E001",
          "revision": 1,
          "locator": "消息 1，脱敏摘要第 1 段"
        }
      ],
      "object_alias": "APP_A",
      "event_window": "合成窗口 W1",
      "is_new_collection": false,
      "risk_floor": "R0",
      "content_limit": "一个已有摘要",
      "stop_conditions": "超出允许分享范围时不提供",
      "redaction_requirements": "仅匿名对象，不含客户标识",
      "alternative_material": "允许分享的人工计数摘要",
      "information_gain": "核对等待持续时间与连接占用是否同窗",
      "target_candidate_refs": [
        "H01"
      ],
      "if_positive": "合成：若同窗借出时长异常且先于排队，增加对 H01 的支持。",
      "if_negative": "合成：若借出时长正常而其他等待先出现，削弱 H01 并检查替代解释。"
    }
  ],
  "handoff_proposals": [],
  "review_needs": [],
  "routing_proposals": []
}
